<?xml version="1.0" encoding="UTF-8"?>
<!-- This document contains data on Codifica di Testi aa 20-21.
    Filename: esercizio6_DTDattributi.xml
    Author: Martina Mele
    LM Informatica Umanistica
    Date: 29/03/2021 
    Esercizio: 
                - elemento root: TEI
                - elementi figli:
                    - header (obbligatorio una occorrenza)
                    - facsimile (opzionale una occorrenza)
                    - text (obbligatorio almeno una occorrenza)
                * text è un mixed content con possibile elemento <seg>

                Attributi:
                - header: type:(fixed, CDATA “intestazione”); lang(opzionale, NMTOKEN)
                - facsimile: source:(obbligatorio); ref(optionale, IDREFS)
                - text: id(obbligatorio, ID) type(opzionale contenuto testuale)-->

<!DOCTYPE TEI SYSTEM "./6a.DTDattributi.dtd">

<TEI> <!--elemento root-->

    <header type="intestazione" lang="it">
        Questo è solo testo senza tag figli.
    </header>
    
    <facsimile source="" ref="one"> <!--è opzionale, potremmo anche non inserirlo-->
        Questo è solo testo.
    </facsimile>

    <text id="one" type="tipo">
        <p>Questo è un <seg>mixed content</seg>.</p>
    </text>

    <text id="two" type="prova">
        <p>Questo è un paragrafo.</p>
    </text>

</TEI>